评论者主页,评论者昵称,评论者性别,评论者所在地,评论者微博数,评论者关注数,评论者粉丝数,评论内容,评论获赞数,评论发布时间
https://weibo.cn//u/7409363246,麻木不仁被监视,男,云南,93,97,31,警官你好：我被人威胁、软禁，被三个专业拿工资的河南人监视，周围百姓无人不知，行为非常恶劣百姓无人敢言，纷纷议论什么世道呀。最近我到各个公安部门报案，本以为派出所会制止但对方实力强大明目张胆一点不胆怯.还恶语相对威胁到，非玩死你、耗死你。和谐社会、希望人人平等,0,2020-03-17 22:13
https://weibo.cn//u/3086263953,立升净水器_吉之美开水器,男,河北,1973,811,234,: 新浪辟谣、头条辟谣、网易、各地公安微博等等都辟谣说这日本消毒卡消毒是假的是谣言，甚至有的说还有反作用。有个人说新冠病毒是美国传过来的直接被拘了，这卖假货的倒没人管了。这到底是造谣的说了谣言，还是辟谣的说了假话？你们这要是也没音，那可就真省省心了,0,2020-03-17 19:39
https://weibo.cn//banxiadeqiu,秋橙不吃橙子吃西瓜,男,江苏,5698,293,548,光一句没发布过定屁用,0,2020-03-17 15:20
https://weibo.cn//u/3501351383,江南驿路梨花,女,安徽,379,1281,197,每天12万人回国是不是真的？,0,2020-03-17 14:19
https://weibo.cn//u/3108971053,徐谋aT,男,江苏,46,88,179,富三代，别想多了,0,2020-03-17 12:55
https://weibo.cn//u/3108971053,徐谋aT,男,江苏,46,88,179,在巴黎罗马柏林开超跑的三代们要回来了,0,2020-03-17 12:54
https://weibo.cn//u/1570395607,原来是李沧海,女,海外,964,288,380,那么……是多少呢？,0,2020-03-17 12:49
