评论者主页,评论者昵称,评论者性别,评论者所在地,评论者微博数,评论者关注数,评论者粉丝数,评论内容,评论获赞数,评论发布时间
https://weibo.cn//634530521,AMIRA_OFFICIAL,女,北京,179,263,100,公交没查，我前天坐过，都没查体温，还有没带口罩的,0,2020-02-10 02:41
https://weibo.cn//MrZeven,MrZeven,男,北京,98,61,218,光测体温没什么用，武汉传的那么厉害就是因为潜伏期大家都不知道，人传人，北京严点好，不然首都就完了。,1,2020-02-09 19:22
https://weibo.cn//u/2592952825,陈家阿萱,男,山东,238,344,36,我觉身份证号码很重要,0,2020-02-09 18:37
https://weibo.cn//qsun126,孙齐的马甲,男,北京,1820,742,2645,一天天的，得辟多少谣，看都看累了。。抓个发布不实消息的还一堆人出来bb，你们自己看着不累吗？,0,2020-02-09 17:12
https://weibo.cn//su6518,文字给力承诺总变,男,北京,21621,272,969,卧槽 你还不如登记呢刷身份证上下车免的到时候找人,1,2020-02-09 17:06
