评论者主页,评论者昵称,评论者性别,评论者所在地,评论者微博数,评论者关注数,评论者粉丝数,评论内容,评论获赞数,评论发布时间
https://weibo.cn//239850121,糯米妈妈Vin,女,河北,2466,2688,551,回复@瓶子Agnes:找社区处理的,0,2020-08-18 07:23
https://weibo.cn//u/3184598137,瓶子Agnes,女,其他,404,634,288,回复@糯米妈妈Vin:后来怎么解决的 亲,0,2020-08-12 08:14
https://weibo.cn//239850121,糯米妈妈Vin,女,河北,2466,2688,551,请问只是路过变黄，也做了核酸检测，阴性，怎么才能变绿,0,2020-06-29 21:44
https://weibo.cn//u/2955410575,小宇宙是不吃冬瓜的小猴子,女,海外,699,483,547,路过就变了啊 是事实。谁在操纵就不得而知了,0,2020-06-27 15:15
https://weibo.cn//u/5363943397,穿面条的小牛肉,女,北京,230,384,156,只是路过玉泉东现在变黄了。。,0,2020-06-27 12:53
https://weibo.cn//ariesei,机智少年流光光,男,海外,4022,305,677,这不是谣言吧。我只是坐车路过就变黄了（而且是530），就已经居家隔离一周了。我联系了我的社区，我的社区说不知道哪里给我标注变黄了。我问了大半个北京，丰台区那边说他们拿到大数据名单就给我变色了。但他们不能给我变回来，让我找我的社区，我的社区又说不是他们上的，他们不会。…,0,2020-06-27 10:00
https://weibo.cn//u/1403357387,插花的牛粪,男,北京,110,378,86,我是路过新发地，健康宝已经变成居家隔离。,2,2020-06-27 09:03
https://weibo.cn//wolfccb,wolfccb,男,北京,518,191,2349,疫情期间影响最大的谣言“新冠病毒是中国合成泄露”，始作俑者武小华就在北京海淀，为什么不抓？,1,2020-06-25 15:55
https://weibo.cn//u/2243656481,平凡区区,女,北京,2155,95,83,确实有人信,0,2020-06-25 13:57
