评论者主页,评论者昵称,评论者性别,评论者所在地,评论者微博数,评论者关注数,评论者粉丝数,评论内容,评论获赞数,评论发布时间
https://weibo.cn//u/5361371323,Cwj-Q,女,湖南,442,290,151,那这些城中村大概什么时候可以解封啊,0,2020-03-01 07:41
https://weibo.cn//rongyaya,吉吉SuZi,女,广东,6597,1102,241,还有这事,0,2020-02-26 13:31
https://weibo.cn//mspiglet,Ms_Piggie,女,广东,962,291,157,治愈了要隔离十四天,0,2020-02-26 12:43
https://weibo.cn//u/3983604740,一地小鸟,女,北京,1506,737,91,自己得过病还这样戴口罩？真的不经心？还是心理不平衡？,4,2020-02-26 11:56
https://weibo.cn//u/6795249599,种花家兔子666,女,其他,33,18,4,她可能是想透会儿气?,0,2020-02-26 11:51
https://weibo.cn//u/5093883171,纸币收藏与投资,男,其他,3886,1140,304,治好了，就不管那么多了？应该严厉处罚下,5,2020-02-26 11:34
https://weibo.cn//u/1720841342,照见99,男,广东,3541,269,500,这个人要行政拘留才行！！！自己都是潜在危险人员了，不仅不注意隔离，还不做好防护措施。,2,2020-02-26 11:34
