评论者主页,评论者昵称,评论者性别,评论者所在地,评论者微博数,评论者关注数,评论者粉丝数,评论内容,评论获赞数,评论发布时间
https://weibo.cn//u/5710822247,月亮上住个妖怪,女,湖北,59,151,63,回复@这么样6523692573:一天的么,0,2020-03-27 16:41
https://weibo.cn//u/6523692573,这么样6523692573,男,其他,6,105,3,回复@月亮上住个妖怪:一个人200到300左右，,0,2020-03-27 16:38
https://weibo.cn//u/5710822247,月亮上住个妖怪,女,湖北,59,151,63,回复@这么样6523692573:我家里人准备来石家庄 听朋友说隔离一天五百是真的么,0,2020-03-27 15:44
https://weibo.cn//u/6523692573,这么样6523692573,男,其他,6,105,3,别指望石家庄了，去了还挣你300隔离费用了，北京都居家隔离，石家庄还非得集中隔离，隔离下来半年工资都没有多少，石家庄政策真的让人心寒,1,2020-03-26 17:29
https://weibo.cn//u/1180351757,荔枝1314,男,其他,9319,137,115,所以现在每天正定机场到底多少人入境。是不是入境就隔离？,1,2020-03-25 17:28
https://weibo.cn//qjxvip,木子_1303,女,河北,175,355,234,湖北同胞什么时候让进石家庄,3,2020-03-25 16:16
