评论者主页,评论者昵称,评论者性别,评论者所在地,评论者微博数,评论者关注数,评论者粉丝数,评论内容,评论获赞数,评论发布时间
https://weibo.cn//u/5427794179,广阳检察,男,北京,1570,92,2453,//,0,2020-01-24 07:35
https://weibo.cn//langfangga,廊坊公安网络发言人,男,河北,8495,2126,335826,【转发辟谣！,0,2020-01-23 23:08
https://weibo.cn//waynebatman,别这样_哼,男,海外,20,577,2389,去你dy的，当初武汉还辟谣不人传人呢！现在网上都找不到那个辟谣新闻了！老子谁都不信！老子就窝在家里哪都不去！,1,2020-01-23 22:26
https://weibo.cn//u/7127921904,小风衣一,女,其他,4754,2221,68,并且我严重怀疑他们一家是准备逃离湖北的，要不他们二十多号人怎么会在手术结束的时候都在，可耻！太可耻了！,0,2020-01-23 20:14
https://weibo.cn//u/7127921904,小风衣一,女,其他,4754,2221,68,麻烦关注一下湖北荆门的伤医事件吧！两辆车相撞一女子受伤，医院开通外伤绿色通道救治，最终女子抢救无效，死因是主动脉破裂，事后其二十多名家属殴打医生还逼医生下跪，医生脑震荡，多处软组织受伤等症状，最后警察才拘留五天，还有人警告他们说亲属里有人是财政高官来压医生,0,2020-01-23 20:10
https://weibo.cn//ssga,石狮公安,男,福建,31624,951,410209,     举报             赞[0]         回复             2020-01-23 19:58:21 来自网页,0,2020-01-23 19:58
https://weibo.cn//u/6463714614,开始2018555国画,女,其他,257,381,149,新型病毒跟普通感冒不一样，关键时刻还是挺医生的吧！,0,2020-01-23 19:54
https://weibo.cn//zj10010,浙江联通,男,浙江,36060,155,1229190,勤洗手，戴口罩，少去人群密集场所，不轻信谣言，我们一起防疫病毒，过个安康吉祥年,1,2020-01-23 19:50
