评论者主页,评论者昵称,评论者性别,评论者所在地,评论者微博数,评论者关注数,评论者粉丝数,评论内容,评论获赞数,评论发布时间
https://weibo.cn//u/2615610933,BINICHEINSTIFT,女,其他,12660,199,288,刚才图片好像不太清晰，不好意思 ,0,2020-01-31 14:03
https://weibo.cn//u/2615610933,BINICHEINSTIFT,女,其他,12660,199,288,你好，西安市阎良区人民医院作为新冠病毒的定点收治医院已经开始缺物资了，我的妹妹就在该医院呼吸内科工作，消息真实可信，可否请求借助贵平台发布接受捐赠的消息，感激不尽！ ,0,2020-01-31 14:01
https://weibo.cn//guchengyidiantong,一点资讯陕西,男,陕西,4991,360,21801,//@西安发布:辟谣！     举报             赞[0]         回复             2020-01-31 13:30:19 来自网页,0,2020-01-31 13:30
https://weibo.cn//u/1771299220,W王蒲,男,陕西,475,266,363,我们小区还有人扎堆下象棋也不戴口罩。。。。。。。,0,2020-01-31 13:06
https://weibo.cn//u/3310919231,9玖零後0,男,上海,1160,364,217,谣言和真相仅一墙之隔,0,2020-01-31 12:58
